{
  "schema_version": "x07.mcp.corpus.result@0.2.0",
  "generated_at": "2026-01-01T00:00:00Z",
  "tool": "hardproof",
  "tool_version": "0.4.0-beta.8",
  "ok": true,
  "details": {
    "report_id": "quality-report-001",
    "server_id": "good-http",
    "status": "warn",
    "score_truth_status": "publishable",
    "source": {
      "repo": "https://github.com/x07lang/hardproof",
      "version": "fixtures"
    },
    "scores": {
      "conformance": 100,
      "security": 100,
      "performance": 100,
      "trust": 80,
      "reliability": 100,
      "overall": 96
    }
  },
  "outputs": {
    "out_dir": "out/good-http",
    "scan_json": "out/good-http/scan.json"
  }
}
